{
  "category": "opensource",
  "nameKo": "오픈소스",
  "fetchedAt": "2026-10-24",
  "total": 25266,
  "subcategories": [
    {
      "id": "models",
      "nameKo": "AI 모델",
      "count": 7771,
      "sources": [
        {
          "id": "hf-models",
          "name": "Hugging Face 모델",
          "count": 7511
        },
        {
          "id": "ollama",
          "name": "Ollama 모델 라이브러리",
          "count": 260
        }
      ]
    },
    {
      "id": "ai-demos",
      "nameKo": "AI 데모 앱 (스페이스)",
      "count": 1788,
      "sources": [
        {
          "id": "hf-spaces",
          "name": "Hugging Face 스페이스",
          "count": 1788
        }
      ]
    },
    {
      "id": "ai-apps",
      "nameKo": "AI 앱·에이전트 프로젝트",
      "count": 1813,
      "sources": [
        {
          "id": "codeberg",
          "name": "Codeberg 인기 저장소",
          "count": 12
        },
        {
          "id": "github-lists",
          "name": "GitHub 오픈소스 (주제별 awesome 목록)",
          "count": 1777
        },
        {
          "id": "gitlab",
          "name": "GitLab.com 인기 프로젝트 (주제별)",
          "count": 10
        },
        {
          "id": "selfhosted",
          "name": "awesome-selfhosted",
          "count": 14
        }
      ]
    },
    {
      "id": "apps",
      "nameKo": "바로 쓰는 오픈소스 앱",
      "count": 1527,
      "sources": [
        {
          "id": "codeberg",
          "name": "Codeberg 인기 저장소",
          "count": 37
        },
        {
          "id": "github-lists",
          "name": "GitHub 오픈소스 (주제별 awesome 목록)",
          "count": 272
        },
        {
          "id": "gitlab",
          "name": "GitLab.com 인기 프로젝트 (주제별)",
          "count": 26
        },
        {
          "id": "selfhosted",
          "name": "awesome-selfhosted",
          "count": 1192
        }
      ]
    },
    {
      "id": "js-libraries",
      "nameKo": "JavaScript 라이브러리",
      "count": 2000,
      "sources": [
        {
          "id": "npm",
          "name": "npm 인기 라이브러리",
          "count": 2000
        }
      ]
    },
    {
      "id": "py-libraries",
      "nameKo": "Python 라이브러리",
      "count": 1000,
      "sources": [
        {
          "id": "pypi",
          "name": "PyPI 인기 라이브러리",
          "count": 1000
        }
      ]
    },
    {
      "id": "dart-libraries",
      "nameKo": "Flutter·Dart 패키지",
      "count": 500,
      "sources": [
        {
          "id": "pub-dev",
          "name": "pub.dev 인기 라이브러리",
          "count": 500
        }
      ]
    },
    {
      "id": "auth",
      "nameKo": "로그인·인증",
      "count": 998,
      "sources": [
        {
          "id": "codeberg",
          "name": "Codeberg 인기 저장소",
          "count": 1
        },
        {
          "id": "github-lists",
          "name": "GitHub 오픈소스 (주제별 awesome 목록)",
          "count": 996
        },
        {
          "id": "gitlab",
          "name": "GitLab.com 인기 프로젝트 (주제별)",
          "count": 1
        }
      ]
    },
    {
      "id": "cms",
      "nameKo": "CMS·블로그 엔진",
      "count": 749,
      "sources": [
        {
          "id": "codeberg",
          "name": "Codeberg 인기 저장소",
          "count": 5
        },
        {
          "id": "github-lists",
          "name": "GitHub 오픈소스 (주제별 awesome 목록)",
          "count": 658
        },
        {
          "id": "gitlab",
          "name": "GitLab.com 인기 프로젝트 (주제별)",
          "count": 2
        },
        {
          "id": "selfhosted",
          "name": "awesome-selfhosted",
          "count": 84
        }
      ]
    },
    {
      "id": "ecommerce",
      "nameKo": "쇼핑몰·결제",
      "count": 489,
      "sources": [
        {
          "id": "github-lists",
          "name": "GitHub 오픈소스 (주제별 awesome 목록)",
          "count": 462
        },
        {
          "id": "gitlab",
          "name": "GitLab.com 인기 프로젝트 (주제별)",
          "count": 1
        },
        {
          "id": "selfhosted",
          "name": "awesome-selfhosted",
          "count": 26
        }
      ]
    },
    {
      "id": "bots",
      "nameKo": "봇 (디스코드·텔레그램·슬랙)",
      "count": 1153,
      "sources": [
        {
          "id": "codeberg",
          "name": "Codeberg 인기 저장소",
          "count": 3
        },
        {
          "id": "github-lists",
          "name": "GitHub 오픈소스 (주제별 awesome 목록)",
          "count": 1139
        },
        {
          "id": "gitlab",
          "name": "GitLab.com 인기 프로젝트 (주제별)",
          "count": 11
        }
      ]
    },
    {
      "id": "extensions",
      "nameKo": "브라우저 확장",
      "count": 882,
      "sources": [
        {
          "id": "codeberg",
          "name": "Codeberg 인기 저장소",
          "count": 2
        },
        {
          "id": "github-lists",
          "name": "GitHub 오픈소스 (주제별 awesome 목록)",
          "count": 877
        },
        {
          "id": "gitlab",
          "name": "GitLab.com 인기 프로젝트 (주제별)",
          "count": 3
        }
      ]
    },
    {
      "id": "cli",
      "nameKo": "명령줄 도구",
      "count": 987,
      "sources": [
        {
          "id": "codeberg",
          "name": "Codeberg 인기 저장소",
          "count": 18
        },
        {
          "id": "github-lists",
          "name": "GitHub 오픈소스 (주제별 awesome 목록)",
          "count": 951
        },
        {
          "id": "gitlab",
          "name": "GitLab.com 인기 프로젝트 (주제별)",
          "count": 18
        }
      ]
    },
    {
      "id": "games",
      "nameKo": "게임·게임 엔진",
      "count": 1468,
      "sources": [
        {
          "id": "codeberg",
          "name": "Codeberg 인기 저장소",
          "count": 14
        },
        {
          "id": "github-lists",
          "name": "GitHub 오픈소스 (주제별 awesome 목록)",
          "count": 1386
        },
        {
          "id": "gitlab",
          "name": "GitLab.com 인기 프로젝트 (주제별)",
          "count": 26
        },
        {
          "id": "selfhosted",
          "name": "awesome-selfhosted",
          "count": 42
        }
      ]
    },
    {
      "id": "projects",
      "nameKo": "그 밖의 오픈소스 프로젝트",
      "count": 705,
      "sources": [
        {
          "id": "codeberg",
          "name": "Codeberg 인기 저장소",
          "count": 247
        },
        {
          "id": "github-lists",
          "name": "GitHub 오픈소스 (주제별 awesome 목록)",
          "count": 285
        },
        {
          "id": "gitlab",
          "name": "GitLab.com 인기 프로젝트 (주제별)",
          "count": 173
        }
      ]
    },
    {
      "id": "awesome",
      "nameKo": "어썸 리스트 (주제별 모음)",
      "count": 1436,
      "sources": [
        {
          "id": "awesome-lists",
          "name": "어썸 리스트 (주제별 모음 저장소)",
          "count": 1436
        }
      ]
    }
  ],
  "sources": [
    {
      "id": "awesome-lists",
      "name": "어썸 리스트 (주제별 모음 저장소)",
      "url": "https://awesome.ecosyste.ms/",
      "license": "List index and repository metadata from awesome.ecosyste.ms (CC BY-SA 4.0); each list keeps its own license (field license).",
      "count": 1436,
      "cut": "별 1,000개 이상, 설명이 있는 목록",
      "note": "awesome.ecosyste.ms에 색인된 목록은 1만 개가 넘는다. entries는 그 목록이 가리키는 항목 수다."
    },
    {
      "id": "codeberg",
      "name": "Codeberg 인기 저장소",
      "url": "https://codeberg.org/explore/repos",
      "license": "Repository metadata from the public Codeberg (Gitea) API. License is not exposed by the list API, so the field is left empty.",
      "count": 339,
      "cut": "별 50개 이상, 포크·보관·설명 없는 저장소 제외 (전체 약 45만 개)"
    },
    {
      "id": "github-lists",
      "name": "GitHub 오픈소스 (주제별 awesome 목록)",
      "url": "https://awesome.ecosyste.ms/",
      "license": "Repository choice from community awesome lists (indexed by awesome.ecosyste.ms, CC BY-SA 4.0); repository metadata from repos.ecosyste.ms (CC BY-SA 4.0); each repository keeps its own license (field license).",
      "count": 8803,
      "cut": "별 50개 이상, 포크 제외 (보관된 저장소는 archived 꼬리표). 목록: e2b-dev/awesome-ai-agents, kyrolabs/awesome-agents, Jenqyang/Awesome-AI-Agents, steel-dev/awesome-web-agents, sindresorhus/awesome-chatgpt, Danielskry/Awesome-RAG, bradagi/awesome-cli-coding-agents, casdoor/awesome-auth, yackermann/awesome-webauthn, mjhea0/awesome-fastapi, humiaozuzu/awesome-flask, Solido/awesome-flutter, PatrickJS/awesome-angular, myles/awesome-static-generators, sindresorhus/awesome-nodejs, chiraggude/awesome-laravel, wsvincent/awesome-django, DenisIzmaylov/awesome-telegram-bots, ebertti/awesome-telegram, jacc/awesome-discord, matiassingers/awesome-slack, telegram-mini-apps-dev/awesome-telegram-mini-apps, fregante/Awesome-WebExtensions, linsa-io/chrome-extensions, agarrharr/awesome-cli-apps, shadawck/awesome-cli-frameworks, michelpereira/awesome-open-source-games, bobeff/open-source-games, proyecto26/awesome-jsgames, stevinz/awesome-game-engine-dev, sindresorhus/awesome-electron, tauri-apps/awesome-tauri, jondot/awesome-react-native, vuejs/awesome-vue, unicodeveloper/awesome-nextjs, nestjs/awesome-nestjs, vitejs/awesome-vite, Alexintosh/Awesome-Ionic, TheComputerM/awesome-svelte",
      "note": "GitHub 주제 검색(별 순)은 GitHub 검색 API가 되는 곳에서만 더해진다. 이 판은 awesome 목록만으로 만들었다."
    },
    {
      "id": "gitlab",
      "name": "GitLab.com 인기 프로젝트 (주제별)",
      "url": "https://gitlab.com/explore/projects/topics",
      "license": "Project metadata from the public GitLab.com REST API; each project keeps its own license (field license).",
      "count": 271,
      "cut": "주제 56개마다 별 20개 이상, 포크·보관·설명 없는 프로젝트 제외"
    },
    {
      "id": "hf-models",
      "name": "Hugging Face 모델",
      "url": "https://huggingface.co/models",
      "license": "Hugging Face Hub public API metadata (model id, task, downloads, likes, license tag) and the first paragraph of each public model card; each model keeps its own license (field license).",
      "count": 7511,
      "cut": "작업(47개)마다 최근 30일 내려받기 10,000회 이상 + 작업마다 상위 20개 + 좋아요 300개 이상 + 요즘 뜨는 순 상위 500개",